<?xml version="1.0" encoding="ISO-8859-1"?>
<heprep:heprep xmlns:heprep='http://java.freehep.org/schemas/heprep/1.0'
               xmlns:xsi='http://www.w3.org/2001/XMLSchema-instance' 
               xsi:schemaLocation='http://java.freehep.org/schemas/heprep/1.0 http://java.freehep.org/schemas/heprep/1.0/HepRep.xsd'>

    <heprep:type name="TestText">
        <heprep:attvalue name="drawAs" value="Text" />
        <heprep:attvalue name="HPos" value="0.7" />
        <heprep:attvalue name="VPos" value="0.3" />
        <heprep:instance>
            <heprep:primitive>
                <heprep:point x="0.0" y="0.0" z="0.0" />
            </heprep:primitive>
        </heprep:instance>        
    </heprep:type>

</heprep:heprep>
